"No.","Time","Source","Destination","Protocol","Length","Info"
"1","0.000000","2620:1ec:50::12","2405:201:5006:95a:3ddc:1390:95b:795e","TLSv1.2","113","Application Data"
"2","0.012116","2405:201:5006:95a:3ddc:1390:95b:795e","2620:1ec:50::12","TLSv1.2","109","Application Data"
"3","0.012232","2405:201:5006:95a:3ddc:1390:95b:795e","2620:1ec:50::12","TLSv1.2","109","Application Data"
"4","0.031161","2620:1ec:50::12","2405:201:5006:95a:3ddc:1390:95b:795e","TCP","74","443  >  50265 [ACK] Seq=40 Ack=71 Win=16383 Len=0"
"5","0.163246","Arcadyan_fc:4a:0e","Intel_8d:f9:87","ARP","42","Who has 192.168.29.143? Tell 192.168.29.1"
"6","0.163269","Intel_8d:f9:87","Arcadyan_fc:4a:0e","ARP","42","192.168.29.143 is at b4:6d:83:8d:f9:87"
"7","0.185927","2405:201:5006:95a:3ddc:1390:95b:795e","2404:6800:4002:82b::200a","TCP","75","50518  >  443 [ACK] Seq=1 Ack=1 Win=517 Len=1"
"8","0.204569","2404:6800:4002:82b::200a","2405:201:5006:95a:3ddc:1390:95b:795e","TCP","86","443  >  50518 [ACK] Seq=1 Ack=2 Win=1044 Len=0 SLE=1 SRE=2"
"9","0.467522","2405:201:5006:95a:3ddc:1390:95b:795e","2603:1040:a06:3::8","TLSv1.2","112","Application Data"
"10","0.510910","2603:1040:a06:3::8","2405:201:5006:95a:3ddc:1390:95b:795e","TCP","74","443  >  50230 [ACK] Seq=1 Ack=39 Win=501 Len=0"
"11","1.017359","2405:201:5006:95a:3ddc:1390:95b:795e","2405:201:5006:95a::c0a8:1d01","ICMPv6","86","Neighbor Solicitation for 2405:201:5006:95a::c0a8:1d01 from b4:6d:83:8d:f9:87"
"12","1.020578","2405:201:5006:95a::c0a8:1d01","2405:201:5006:95a:3ddc:1390:95b:795e","ICMPv6","78","Neighbor Advertisement 2405:201:5006:95a::c0a8:1d01 (rtr, sol)"
"13","3.178219","192.168.29.143","224.0.0.251","MDNS","82","Standard query 0x0000 PTR _googlecast._tcp.local, ""QM"" question"
"14","4.322362","2603:1040:a06:3::8","2405:201:5006:95a:3ddc:1390:95b:795e","TLSv1.2","108","Application Data"
"15","4.374446","2405:201:5006:95a:3ddc:1390:95b:795e","2603:1040:a06:3::8","TCP","74","50230  >  443 [ACK] Seq=39 Ack=35 Win=509 Len=0"
"16","5.153468","2405:201:5006:95a:3ddc:1390:95b:795e","2600:1901:1:388::","TCP","75","50501  >  443 [ACK] Seq=1 Ack=1 Win=514 Len=1"
"17","5.179124","2600:1901:1:388::","2405:201:5006:95a:3ddc:1390:95b:795e","TCP","86","443  >  50501 [ACK] Seq=1 Ack=2 Win=1045 Len=0 SLE=1 SRE=2"
"18","6.281768","2405:201:5006:95a:3ddc:1390:95b:795e","2600:1901:1:304::","TLSv1.2","109","Application Data"
"19","6.300793","2600:1901:1:304::","2405:201:5006:95a:3ddc:1390:95b:795e","TCP","74","443  >  50383 [ACK] Seq=1 Ack=36 Win=1050 Len=0"
"20","11.329180","2405:201:5006:95a:3ddc:1390:95b:795e","2405:201:5006:95a::c0a8:1d01","DNS","96","Standard query 0x6239 A www.msftncsi.com"
"21","11.330657","2405:201:5006:95a:3ddc:1390:95b:795e","2405:201:5006:95a::c0a8:1d01","DNS","96","Standard query 0x6ade AAAA www.msftncsi.com"
"22","11.337146","2405:201:5006:95a::c0a8:1d01","2405:201:5006:95a:3ddc:1390:95b:795e","DNS","173","Standard query response 0x6ade AAAA www.msftncsi.com CNAME www.msftncsi.com.edgesuite.net CNAME a1961.g2.akamai.net"
"23","11.344755","2405:201:5006:95a::c0a8:1d01","2405:201:5006:95a:3ddc:1390:95b:795e","DNS","202","Standard query response 0x6239 A www.msftncsi.com CNAME www.msftncsi.com.edgesuite.net CNAME a1961.g2.akamai.net A 49.44.179.211 A 49.44.179.225"
"24","11.346217","192.168.29.143","49.44.179.211","TCP","66","50530  >  80 [SYN] Seq=0 Win=64240 Len=0 MSS=1460 WS=256 SACK_PERM"
"25","11.362496","49.44.179.211","192.168.29.143","TCP","66","80  >  50530 [SYN, ACK] Seq=0 Ack=1 Win=64240 Len=0 MSS=1460 SACK_PERM WS=128"
"26","11.362706","192.168.29.143","49.44.179.211","TCP","54","50530  >  80 [ACK] Seq=1 Ack=1 Win=131328 Len=0"
"27","11.363282","192.168.29.143","49.44.179.211","HTTP","148","GET /ncsi.txt HTTP/1.1 "
"28","11.379143","49.44.179.211","192.168.29.143","TCP","54","80  >  50530 [ACK] Seq=1 Ack=95 Win=64256 Len=0"
"29","11.383474","49.44.179.211","192.168.29.143","HTTP","233","HTTP/1.1 200 OK  (text/plain)"
"30","11.383710","49.44.179.211","192.168.29.143","TCP","54","80  >  50530 [FIN, ACK] Seq=180 Ack=95 Win=64256 Len=0"
"31","11.383812","192.168.29.143","49.44.179.211","TCP","54","50530  >  80 [ACK] Seq=95 Ack=181 Win=131072 Len=0"
"32","11.384012","192.168.29.143","49.44.179.211","TCP","54","50530  >  80 [FIN, ACK] Seq=95 Ack=181 Win=131072 Len=0"
"33","11.697740","192.168.29.143","49.44.179.211","TCP","54","[TCP Retransmission] 50530  >  80 [FIN, ACK] Seq=95 Ack=181 Win=131072 Len=0"
"34","11.709949","49.44.179.211","192.168.29.143","TCP","54","80  >  50530 [ACK] Seq=181 Ack=96 Win=64256 Len=0"
"35","11.878930","2600:1901:1:304::","2405:201:5006:95a:3ddc:1390:95b:795e","TLSv1.2","1294","Application Data"
"36","11.879132","2600:1901:1:304::","2405:201:5006:95a:3ddc:1390:95b:795e","TLSv1.2","1294","Application Data"
"37","11.879176","2405:201:5006:95a:3ddc:1390:95b:795e","2600:1901:1:304::","TCP","74","50383  >  443 [ACK] Seq=36 Ack=2441 Win=517 Len=0"
"38","11.879554","2600:1901:1:304::","2405:201:5006:95a:3ddc:1390:95b:795e","TLSv1.2","1294","Application Data"
"39","11.880104","2600:1901:1:304::","2405:201:5006:95a:3ddc:1390:95b:795e","TLSv1.2","1294","Application Data"
"40","11.880167","2405:201:5006:95a:3ddc:1390:95b:795e","2600:1901:1:304::","TCP","74","50383  >  443 [ACK] Seq=36 Ack=4881 Win=517 Len=0"
"41","11.881345","2600:1901:1:304::","2405:201:5006:95a:3ddc:1390:95b:795e","TLSv1.2","1294","Application Data"
"42","11.881908","2600:1901:1:304::","2405:201:5006:95a:3ddc:1390:95b:795e","TLSv1.2","347","Application Data"
"43","11.881969","2405:201:5006:95a:3ddc:1390:95b:795e","2600:1901:1:304::","TCP","74","50383  >  443 [ACK] Seq=36 Ack=6374 Win=517 Len=0"
"44","12.535957","2600:1901:1:304::","2405:201:5006:95a:3ddc:1390:95b:795e","TLSv1.2","1294","Application Data"
"45","12.536177","2600:1901:1:304::","2405:201:5006:95a:3ddc:1390:95b:795e","TLSv1.2","1294","Application Data"
"46","12.536206","2405:201:5006:95a:3ddc:1390:95b:795e","2600:1901:1:304::","TCP","74","50383  >  443 [ACK] Seq=36 Ack=8814 Win=517 Len=0"
"47","12.536931","2600:1901:1:304::","2405:201:5006:95a:3ddc:1390:95b:795e","TLSv1.2","1294","Application Data"
"48","12.536931","2600:1901:1:304::","2405:201:5006:95a:3ddc:1390:95b:795e","TLSv1.2","1294","Application Data"
"49","12.536972","2405:201:5006:95a:3ddc:1390:95b:795e","2600:1901:1:304::","TCP","74","50383  >  443 [ACK] Seq=36 Ack=11254 Win=517 Len=0"
"50","12.538068","2600:1901:1:304::","2405:201:5006:95a:3ddc:1390:95b:795e","TLSv1.2","1294","Application Data"
"51","12.538068","2600:1901:1:304::","2405:201:5006:95a:3ddc:1390:95b:795e","TLSv1.2","1294","Application Data"
"52","12.538140","2405:201:5006:95a:3ddc:1390:95b:795e","2600:1901:1:304::","TCP","74","50383  >  443 [ACK] Seq=36 Ack=13694 Win=517 Len=0"
"53","12.539450","2600:1901:1:304::","2405:201:5006:95a:3ddc:1390:95b:795e","TLSv1.2","208","Application Data"
"54","12.594586","2405:201:5006:95a:3ddc:1390:95b:795e","2600:1901:1:304::","TCP","74","50383  >  443 [ACK] Seq=36 Ack=13828 Win=516 Len=0"
"55","12.608934","15.197.193.114","192.168.29.143","TLSv1.2","85","Application Data"
"56","12.609427","192.168.29.143","15.197.193.114","TLSv1.2","89","Application Data"
"57","12.624701","15.197.193.114","192.168.29.143","TCP","54","443  >  50151 [ACK] Seq=32 Ack=36 Win=409 Len=0"
"58","13.139284","2405:201:5006:95a:3ddc:1390:95b:795e","2405:201:5006:95a::c0a8:1d01","DNS","89","Standard query 0x980e AAAA i.scdn.co"
"59","13.139696","2405:201:5006:95a:3ddc:1390:95b:795e","2405:201:5006:95a::c0a8:1d01","DNS","89","Standard query 0x2b2a A i.scdn.co"
"60","13.140048","2405:201:5006:95a:3ddc:1390:95b:795e","2405:201:5006:95a::c0a8:1d01","DNS","89","Standard query 0x2361 HTTPS i.scdn.co"
"61","13.151083","2405:201:5006:95a::c0a8:1d01","2405:201:5006:95a:3ddc:1390:95b:795e","DNS","375","Standard query response 0x2361 HTTPS i.scdn.co CNAME image-scdn.cdn-gslb.spotify.com CNAME common-eipb-ak.spotifycdn.com.edgesuite.net CNAME squadcdn.scdn.co.splitter-eip.akadns.net CNAME i.scdn.co-noeip.akamaized.net CNAME a1520.dscc.akamai.net SOA n0dscc.akamai.net"
"62","13.153501","2405:201:5006:95a::c0a8:1d01","2405:201:5006:95a:3ddc:1390:95b:795e","DNS","458","Standard query response 0x2b2a A i.scdn.co CNAME image-scdn.cdn-gslb.spotify.com CNAME common-eipb-ak.spotifycdn.com.edgesuite.net CNAME squadcdn.scdn.co.splitter-eip.akadns.net CNAME i.scdn.co-noeip.akamaized.net CNAME a1520.dscc.akamai.net A 49.44.179.202 A 49.44.179.147 A 49.44.179.203 A 49.44.179.187 A 49.44.179.184 A 49.44.179.162 A 49.44.179.192 A 49.44.179.176 A 49.44.179.146"
"63","13.154631","2405:201:5006:95a::c0a8:1d01","2405:201:5006:95a:3ddc:1390:95b:795e","DNS","454","Standard query response 0x980e AAAA i.scdn.co CNAME image-scdn.cdn-gslb.spotify.com CNAME common-eipb-ak.spotifycdn.com.edgesuite.net CNAME squadcdn.scdn.co.splitter-eip.akadns.net CNAME i.scdn.co-noeip.akamaized.net CNAME a1520.dscc.akamai.net AAAA 2405:200:1630:1200::312c:b3b8 AAAA 2405:200:1630:1200::312c:b39a AAAA 2405:200:1630:1200::312c:b3b1 AAAA 2405:200:1630:1200::312c:b3b2 AAAA 2405:200:1630:1200::312c:b3ba"
"64","13.155658","2405:201:5006:95a:3ddc:1390:95b:795e","2405:200:1630:1200::312c:b3b8","TCP","86","50531  >  443 [SYN] Seq=0 Win=64800 Len=0 MSS=1440 WS=256 SACK_PERM"
"65","13.167331","2405:200:1630:1200::312c:b3b8","2405:201:5006:95a:3ddc:1390:95b:795e","TCP","86","443  >  50531 [SYN, ACK] Seq=0 Ack=1 Win=64800 Len=0 MSS=1344 SACK_PERM WS=128"
"66","13.167409","2405:201:5006:95a:3ddc:1390:95b:795e","2405:200:1630:1200::312c:b3b8","TCP","74","50531  >  443 [ACK] Seq=1 Ack=1 Win=131584 Len=0"
"67","13.168015","2405:201:5006:95a:3ddc:1390:95b:795e","2405:200:1630:1200::312c:b3b8","TCP","1418","50531  >  443 [ACK] Seq=1 Ack=1 Win=131584 Len=1344 [TCP PDU reassembled in 68]"
"68","13.168015","2405:201:5006:95a:3ddc:1390:95b:795e","2405:200:1630:1200::312c:b3b8","TLSv1.3","736","Client Hello (SNI=i.scdn.co)"
"69","13.184895","2405:200:1630:1200::312c:b3b8","2405:201:5006:95a:3ddc:1390:95b:795e","TLSv1.3","338","Server Hello, Change Cipher Spec, Application Data, Application Data"
"70","13.185276","2405:201:5006:95a:3ddc:1390:95b:795e","2405:200:1630:1200::312c:b3b8","TLSv1.3","154","Change Cipher Spec, Application Data"
"71","13.185474","2405:201:5006:95a:3ddc:1390:95b:795e","2405:200:1630:1200::312c:b3b8","TLSv1.3","166","Application Data"
"72","13.185726","2405:201:5006:95a:3ddc:1390:95b:795e","2405:200:1630:1200::312c:b3b8","TLSv1.3","375","Application Data"
"73","13.197677","2405:200:1630:1200::312c:b3b8","2405:201:5006:95a:3ddc:1390:95b:795e","TCP","74","443  >  50531 [ACK] Seq=265 Ack=2087 Win=64128 Len=0"
"74","13.198012","2405:200:1630:1200::312c:b3b8","2405:201:5006:95a:3ddc:1390:95b:795e","TLSv1.3","345","Application Data"
"75","13.199467","2405:200:1630:1200::312c:b3b8","2405:201:5006:95a:3ddc:1390:95b:795e","TCP","74","443  >  50531 [ACK] Seq=536 Ack=2179 Win=64128 Len=0"
"76","13.199778","2405:200:1630:1200::312c:b3b8","2405:201:5006:95a:3ddc:1390:95b:795e","TCP","74","443  >  50531 [ACK] Seq=536 Ack=2480 Win=64128 Len=0"
"77","13.202021","2405:200:1630:1200::312c:b3b8","2405:201:5006:95a:3ddc:1390:95b:795e","TLSv1.3","135","Application Data"
"78","13.202088","2405:201:5006:95a:3ddc:1390:95b:795e","2405:200:1630:1200::312c:b3b8","TCP","74","50531  >  443 [ACK] Seq=2480 Ack=597 Win=131072 Len=0"
"79","13.202281","2405:201:5006:95a:3ddc:1390:95b:795e","2405:200:1630:1200::312c:b3b8","TLSv1.3","105","Application Data"
"80","13.202369","2405:200:1630:1200::312c:b3b8","2405:201:5006:95a:3ddc:1390:95b:795e","TLSv1.3","105","Application Data"
"81","13.209129","2405:200:1630:1200::312c:b3b8","2405:201:5006:95a:3ddc:1390:95b:795e","TLSv1.3","375","Application Data"
"82","13.209200","2405:201:5006:95a:3ddc:1390:95b:795e","2405:200:1630:1200::312c:b3b8","TCP","74","50531  >  443 [ACK] Seq=2511 Ack=929 Win=130560 Len=0"
"83","13.209438","2405:200:1630:1200::312c:b3b8","2405:201:5006:95a:3ddc:1390:95b:795e","TLSv1.3","1415","Application Data"
"84","13.209493","2405:201:5006:95a:3ddc:1390:95b:795e","2405:200:1630:1200::312c:b3b8","TCP","74","50531  >  443 [ACK] Seq=2511 Ack=2270 Win=131584 Len=0"
"85","13.219738","2405:200:1630:1200::312c:b3b8","2405:201:5006:95a:3ddc:1390:95b:795e","TCP","1514","443  >  50531 [ACK] Seq=2270 Ack=2511 Win=64128 Len=1440 [TCP PDU reassembled in 99]"
"86","13.219811","2405:201:5006:95a:3ddc:1390:95b:795e","2405:200:1630:1200::312c:b3b8","TCP","74","50531  >  443 [ACK] Seq=2511 Ack=3710 Win=131584 Len=0"
"87","13.220578","2405:200:1630:1200::312c:b3b8","2405:201:5006:95a:3ddc:1390:95b:795e","TCP","1514","443  >  50531 [ACK] Seq=3710 Ack=2511 Win=64128 Len=1440 [TCP PDU reassembled in 99]"
"88","13.220906","2405:200:1630:1200::312c:b3b8","2405:201:5006:95a:3ddc:1390:95b:795e","TCP","1514","443  >  50531 [ACK] Seq=5150 Ack=2511 Win=64128 Len=1440 [TCP PDU reassembled in 99]"
"89","13.220906","2405:200:1630:1200::312c:b3b8","2405:201:5006:95a:3ddc:1390:95b:795e","TCP","1514","443  >  50531 [ACK] Seq=6590 Ack=2511 Win=64128 Len=1440 [TCP PDU reassembled in 99]"
"90","13.220955","2405:201:5006:95a:3ddc:1390:95b:795e","2405:200:1630:1200::312c:b3b8","TCP","74","50531  >  443 [ACK] Seq=2511 Ack=8030 Win=131584 Len=0"
"91","13.221212","2405:200:1630:1200::312c:b3b8","2405:201:5006:95a:3ddc:1390:95b:795e","TCP","1514","443  >  50531 [ACK] Seq=8030 Ack=2511 Win=64128 Len=1440 [TCP PDU reassembled in 99]"
"92","13.221257","2405:201:5006:95a:3ddc:1390:95b:795e","2405:200:1630:1200::312c:b3b8","TCP","74","50531  >  443 [ACK] Seq=2511 Ack=9470 Win=131584 Len=0"
"93","13.221893","2405:200:1630:1200::312c:b3b8","2405:201:5006:95a:3ddc:1390:95b:795e","TCP","1514","443  >  50531 [PSH, ACK] Seq=9470 Ack=2511 Win=64128 Len=1440 [TCP PDU reassembled in 99]"
"94","13.221893","2405:200:1630:1200::312c:b3b8","2405:201:5006:95a:3ddc:1390:95b:795e","TCP","1514","443  >  50531 [ACK] Seq=10910 Ack=2511 Win=64128 Len=1440 [TCP PDU reassembled in 99]"
"95","13.221893","2405:200:1630:1200::312c:b3b8","2405:201:5006:95a:3ddc:1390:95b:795e","TCP","1514","443  >  50531 [ACK] Seq=12350 Ack=2511 Win=64128 Len=1440 [TCP PDU reassembled in 99]"
"96","13.221893","2405:200:1630:1200::312c:b3b8","2405:201:5006:95a:3ddc:1390:95b:795e","TCP","1514","443  >  50531 [ACK] Seq=13790 Ack=2511 Win=64128 Len=1440 [TCP PDU reassembled in 99]"
"97","13.221893","2405:200:1630:1200::312c:b3b8","2405:201:5006:95a:3ddc:1390:95b:795e","TCP","1514","443  >  50531 [ACK] Seq=15230 Ack=2511 Win=64128 Len=1440 [TCP PDU reassembled in 99]"
"98","13.221893","2405:200:1630:1200::312c:b3b8","2405:201:5006:95a:3ddc:1390:95b:795e","TCP","1514","443  >  50531 [ACK] Seq=16670 Ack=2511 Win=64128 Len=1440 [TCP PDU reassembled in 99]"
"99","13.221893","2405:200:1630:1200::312c:b3b8","2405:201:5006:95a:3ddc:1390:95b:795e","TLSv1.3","640","Application Data"
"100","13.221893","2405:200:1630:1200::312c:b3b8","2405:201:5006:95a:3ddc:1390:95b:795e","TLSv1.3","105","Application Data"
"101","13.221893","2405:200:1630:1200::312c:b3b8","2405:201:5006:95a:3ddc:1390:95b:795e","TCP","1514","443  >  50531 [ACK] Seq=18707 Ack=2511 Win=64128 Len=1440 [TCP PDU reassembled in 114]"
"102","13.221893","2405:200:1630:1200::312c:b3b8","2405:201:5006:95a:3ddc:1390:95b:795e","TCP","1514","443  >  50531 [ACK] Seq=20147 Ack=2511 Win=64128 Len=1440 [TCP PDU reassembled in 114]"
"103","13.222013","2405:201:5006:95a:3ddc:1390:95b:795e","2405:200:1630:1200::312c:b3b8","TCP","74","50531  >  443 [ACK] Seq=2511 Ack=21587 Win=131584 Len=0"
"104","13.222303","2405:200:1630:1200::312c:b3b8","2405:201:5006:95a:3ddc:1390:95b:795e","TCP","1514","443  >  50531 [ACK] Seq=21587 Ack=2511 Win=64128 Len=1440 [TCP PDU reassembled in 114]"
"105","13.222303","2405:200:1630:1200::312c:b3b8","2405:201:5006:95a:3ddc:1390:95b:795e","TCP","1514","443  >  50531 [ACK] Seq=23027 Ack=2511 Win=64128 Len=1440 [TCP PDU reassembled in 114]"
"106","13.222303","2405:200:1630:1200::312c:b3b8","2405:201:5006:95a:3ddc:1390:95b:795e","TCP","1514","443  >  50531 [ACK] Seq=24467 Ack=2511 Win=64128 Len=1440 [TCP PDU reassembled in 114]"
"107","13.222303","2405:200:1630:1200::312c:b3b8","2405:201:5006:95a:3ddc:1390:95b:795e","TCP","1514","443  >  50531 [PSH, ACK] Seq=25907 Ack=2511 Win=64128 Len=1440 [TCP PDU reassembled in 114]"
"108","13.222303","2405:200:1630:1200::312c:b3b8","2405:201:5006:95a:3ddc:1390:95b:795e","TCP","1514","443  >  50531 [ACK] Seq=27347 Ack=2511 Win=64128 Len=1440 [TCP PDU reassembled in 114]"
"109","13.222303","2405:200:1630:1200::312c:b3b8","2405:201:5006:95a:3ddc:1390:95b:795e","TCP","1514","443  >  50531 [ACK] Seq=28787 Ack=2511 Win=64128 Len=1440 [TCP PDU reassembled in 114]"
"110","13.222303","2405:200:1630:1200::312c:b3b8","2405:201:5006:95a:3ddc:1390:95b:795e","TCP","1514","443  >  50531 [ACK] Seq=30227 Ack=2511 Win=64128 Len=1440 [TCP PDU reassembled in 114]"
"111","13.222303","2405:200:1630:1200::312c:b3b8","2405:201:5006:95a:3ddc:1390:95b:795e","TCP","1514","443  >  50531 [ACK] Seq=31667 Ack=2511 Win=64128 Len=1440 [TCP PDU reassembled in 114]"
"112","13.222390","2405:201:5006:95a:3ddc:1390:95b:795e","2405:200:1630:1200::312c:b3b8","TCP","74","50531  >  443 [ACK] Seq=2511 Ack=33107 Win=131584 Len=0"
"113","13.222686","2405:200:1630:1200::312c:b3b8","2405:201:5006:95a:3ddc:1390:95b:795e","TCP","1514","443  >  50531 [ACK] Seq=33107 Ack=2511 Win=64128 Len=1440 [TCP PDU reassembled in 114]"
"114","13.222686","2405:200:1630:1200::312c:b3b8","2405:201:5006:95a:3ddc:1390:95b:795e","TLSv1.3","1514","Application Data, Application Data"
"115","13.222686","2405:200:1630:1200::312c:b3b8","2405:201:5006:95a:3ddc:1390:95b:795e","TCP","1514","443  >  50531 [ACK] Seq=35987 Ack=2511 Win=64128 Len=1440 [TCP PDU reassembled in 127]"
"116","13.222686","2405:200:1630:1200::312c:b3b8","2405:201:5006:95a:3ddc:1390:95b:795e","TCP","1514","443  >  50531 [ACK] Seq=37427 Ack=2511 Win=64128 Len=1440 [TCP PDU reassembled in 127]"
"117","13.222686","2405:200:1630:1200::312c:b3b8","2405:201:5006:95a:3ddc:1390:95b:795e","TCP","1514","443  >  50531 [ACK] Seq=38867 Ack=2511 Win=64128 Len=1440 [TCP PDU reassembled in 127]"
"118","13.222686","2405:200:1630:1200::312c:b3b8","2405:201:5006:95a:3ddc:1390:95b:795e","TCP","1514","443  >  50531 [ACK] Seq=40307 Ack=2511 Win=64128 Len=1440 [TCP PDU reassembled in 127]"
"119","13.222686","2405:200:1630:1200::312c:b3b8","2405:201:5006:95a:3ddc:1390:95b:795e","TCP","1514","443  >  50531 [ACK] Seq=41747 Ack=2511 Win=64128 Len=1440 [TCP PDU reassembled in 127]"
"120","13.222686","2405:200:1630:1200::312c:b3b8","2405:201:5006:95a:3ddc:1390:95b:795e","TCP","1514","443  >  50531 [PSH, ACK] Seq=43187 Ack=2511 Win=64128 Len=1440 [TCP PDU reassembled in 127]"
"121","13.222783","2405:201:5006:95a:3ddc:1390:95b:795e","2405:200:1630:1200::312c:b3b8","TCP","74","50531  >  443 [ACK] Seq=2511 Ack=44627 Win=131584 Len=0"
"122","13.223722","2405:200:1630:1200::312c:b3b8","2405:201:5006:95a:3ddc:1390:95b:795e","TCP","1514","443  >  50531 [ACK] Seq=44627 Ack=2511 Win=64128 Len=1440 [TCP PDU reassembled in 127]"
"123","13.223722","2405:200:1630:1200::312c:b3b8","2405:201:5006:95a:3ddc:1390:95b:795e","TCP","1514","443  >  50531 [ACK] Seq=46067 Ack=2511 Win=64128 Len=1440 [TCP PDU reassembled in 127]"
"124","13.223722","2405:200:1630:1200::312c:b3b8","2405:201:5006:95a:3ddc:1390:95b:795e","TCP","1514","443  >  50531 [ACK] Seq=47507 Ack=2511 Win=64128 Len=1440 [TCP PDU reassembled in 127]"
"125","13.223722","2405:200:1630:1200::312c:b3b8","2405:201:5006:95a:3ddc:1390:95b:795e","TCP","1514","443  >  50531 [ACK] Seq=48947 Ack=2511 Win=64128 Len=1440 [TCP PDU reassembled in 127]"
"126","13.223798","2405:201:5006:95a:3ddc:1390:95b:795e","2405:200:1630:1200::312c:b3b8","TCP","74","50531  >  443 [ACK] Seq=2511 Ack=50387 Win=131584 Len=0"
"127","13.223977","2405:200:1630:1200::312c:b3b8","2405:201:5006:95a:3ddc:1390:95b:795e","TLSv1.3","1514","Application Data, Application Data"
"128","13.223977","2405:200:1630:1200::312c:b3b8","2405:201:5006:95a:3ddc:1390:95b:795e","TCP","1514","443  >  50531 [PSH, ACK] Seq=51827 Ack=2511 Win=64128 Len=1440 [TCP PDU reassembled in 142]"
"129","13.224013","2405:201:5006:95a:3ddc:1390:95b:795e","2405:200:1630:1200::312c:b3b8","TCP","74","50531  >  443 [ACK] Seq=2511 Ack=53267 Win=131584 Len=0"
"130","13.224720","2405:200:1630:1200::312c:b3b8","2405:201:5006:95a:3ddc:1390:95b:795e","TCP","1514","443  >  50531 [ACK] Seq=53267 Ack=2511 Win=64128 Len=1440 [TCP PDU reassembled in 142]"
"131","13.224720","2405:200:1630:1200::312c:b3b8","2405:201:5006:95a:3ddc:1390:95b:795e","TCP","1514","443  >  50531 [ACK] Seq=54707 Ack=2511 Win=64128 Len=1440 [TCP PDU reassembled in 142]"
"132","13.224720","2405:200:1630:1200::312c:b3b8","2405:201:5006:95a:3ddc:1390:95b:795e","TCP","1514","443  >  50531 [ACK] Seq=56147 Ack=2511 Win=64128 Len=1440 [TCP PDU reassembled in 142]"
"133","13.224720","2405:200:1630:1200::312c:b3b8","2405:201:5006:95a:3ddc:1390:95b:795e","TCP","1514","443  >  50531 [ACK] Seq=57587 Ack=2511 Win=64128 Len=1440 [TCP PDU reassembled in 142]"
"134","13.224720","2405:200:1630:1200::312c:b3b8","2405:201:5006:95a:3ddc:1390:95b:795e","TCP","1514","443  >  50531 [ACK] Seq=59027 Ack=2511 Win=64128 Len=1440 [TCP PDU reassembled in 142]"
"135","13.224720","2405:200:1630:1200::312c:b3b8","2405:201:5006:95a:3ddc:1390:95b:795e","TCP","1514","443  >  50531 [PSH, ACK] Seq=60467 Ack=2511 Win=64128 Len=1440 [TCP PDU reassembled in 142]"
"136","13.224807","2405:201:5006:95a:3ddc:1390:95b:795e","2405:200:1630:1200::312c:b3b8","TCP","74","50531  >  443 [ACK] Seq=2511 Ack=61907 Win=131584 Len=0"
"137","13.225780","2405:200:1630:1200::312c:b3b8","2405:201:5006:95a:3ddc:1390:95b:795e","TCP","1514","443  >  50531 [ACK] Seq=61907 Ack=2511 Win=64128 Len=1440 [TCP PDU reassembled in 142]"
"138","13.225780","2405:200:1630:1200::312c:b3b8","2405:201:5006:95a:3ddc:1390:95b:795e","TCP","1514","443  >  50531 [ACK] Seq=63347 Ack=2511 Win=64128 Len=1440 [TCP PDU reassembled in 142]"
"139","13.225780","2405:200:1630:1200::312c:b3b8","2405:201:5006:95a:3ddc:1390:95b:795e","TCP","1514","443  >  50531 [ACK] Seq=64787 Ack=2511 Win=64128 Len=1440 [TCP PDU reassembled in 142]"
"140","13.225780","2405:200:1630:1200::312c:b3b8","2405:201:5006:95a:3ddc:1390:95b:795e","TCP","1514","443  >  50531 [ACK] Seq=66227 Ack=2511 Win=64128 Len=1440 [TCP PDU reassembled in 142]"
"141","13.225857","2405:201:5006:95a:3ddc:1390:95b:795e","2405:200:1630:1200::312c:b3b8","TCP","74","50531  >  443 [ACK] Seq=2511 Ack=67667 Win=131584 Len=0"
"142","13.226153","2405:200:1630:1200::312c:b3b8","2405:201:5006:95a:3ddc:1390:95b:795e","TLSv1.3","1514","Application Data, Application Data"
"143","13.226153","2405:200:1630:1200::312c:b3b8","2405:201:5006:95a:3ddc:1390:95b:795e","TCP","1514","443  >  50531 [PSH, ACK] Seq=69107 Ack=2511 Win=64128 Len=1440 [TCP PDU reassembled in 157]"
"144","13.226231","2405:201:5006:95a:3ddc:1390:95b:795e","2405:200:1630:1200::312c:b3b8","TCP","74","50531  >  443 [ACK] Seq=2511 Ack=70547 Win=131584 Len=0"
"145","13.227135","2405:200:1630:1200::312c:b3b8","2405:201:5006:95a:3ddc:1390:95b:795e","TCP","1514","443  >  50531 [ACK] Seq=70547 Ack=2511 Win=64128 Len=1440 [TCP PDU reassembled in 157]"
"146","13.227135","2405:200:1630:1200::312c:b3b8","2405:201:5006:95a:3ddc:1390:95b:795e","TCP","1514","443  >  50531 [PSH, ACK] Seq=71987 Ack=2511 Win=64128 Len=1440 [TCP PDU reassembled in 157]"
"147","13.227200","2405:201:5006:95a:3ddc:1390:95b:795e","2405:200:1630:1200::312c:b3b8","TCP","74","50531  >  443 [ACK] Seq=2511 Ack=73427 Win=131584 Len=0"
"148","13.231929","2405:200:1630:1200::312c:b3b8","2405:201:5006:95a:3ddc:1390:95b:795e","TCP","1514","443  >  50531 [ACK] Seq=73427 Ack=2511 Win=64128 Len=1440 [TCP PDU reassembled in 157]"
"149","13.231929","2405:200:1630:1200::312c:b3b8","2405:201:5006:95a:3ddc:1390:95b:795e","TCP","1514","443  >  50531 [PSH, ACK] Seq=74867 Ack=2511 Win=64128 Len=1440 [TCP PDU reassembled in 157]"
"150","13.231989","2405:201:5006:95a:3ddc:1390:95b:795e","2405:200:1630:1200::312c:b3b8","TCP","74","50531  >  443 [ACK] Seq=2511 Ack=76307 Win=131584 Len=0"
"151","13.236028","2405:200:1630:1200::312c:b3b8","2405:201:5006:95a:3ddc:1390:95b:795e","TCP","1514","443  >  50531 [ACK] Seq=76307 Ack=2511 Win=64128 Len=1440 [TCP PDU reassembled in 157]"
"152","13.236028","2405:200:1630:1200::312c:b3b8","2405:201:5006:95a:3ddc:1390:95b:795e","TCP","1514","443  >  50531 [ACK] Seq=77747 Ack=2511 Win=64128 Len=1440 [TCP PDU reassembled in 157]"
"153","13.236028","2405:200:1630:1200::312c:b3b8","2405:201:5006:95a:3ddc:1390:95b:795e","TCP","1514","443  >  50531 [ACK] Seq=79187 Ack=2511 Win=64128 Len=1440 [TCP PDU reassembled in 157]"
"154","13.236028","2405:200:1630:1200::312c:b3b8","2405:201:5006:95a:3ddc:1390:95b:795e","TCP","1514","443  >  50531 [ACK] Seq=80627 Ack=2511 Win=64128 Len=1440 [TCP PDU reassembled in 157]"
"155","13.236117","2405:201:5006:95a:3ddc:1390:95b:795e","2405:200:1630:1200::312c:b3b8","TCP","74","50531  >  443 [ACK] Seq=2511 Ack=82067 Win=131584 Len=0"
"156","13.236351","2405:200:1630:1200::312c:b3b8","2405:201:5006:95a:3ddc:1390:95b:795e","TCP","1514","443  >  50531 [ACK] Seq=82067 Ack=2511 Win=64128 Len=1440 [TCP PDU reassembled in 157]"
"157","13.236351","2405:200:1630:1200::312c:b3b8","2405:201:5006:95a:3ddc:1390:95b:795e","TLSv1.3","1514","Application Data, Application Data"
"158","13.236388","2405:201:5006:95a:3ddc:1390:95b:795e","2405:200:1630:1200::312c:b3b8","TCP","74","50531  >  443 [ACK] Seq=2511 Ack=84947 Win=131584 Len=0"
"159","13.236993","2405:200:1630:1200::312c:b3b8","2405:201:5006:95a:3ddc:1390:95b:795e","TCP","1514","443  >  50531 [ACK] Seq=84947 Ack=2511 Win=64128 Len=1440 [TCP PDU reassembled in 171]"
"160","13.236993","2405:200:1630:1200::312c:b3b8","2405:201:5006:95a:3ddc:1390:95b:795e","TCP","1514","443  >  50531 [ACK] Seq=86387 Ack=2511 Win=64128 Len=1440 [TCP PDU reassembled in 171]"
"161","13.236993","2405:200:1630:1200::312c:b3b8","2405:201:5006:95a:3ddc:1390:95b:795e","TCP","1514","443  >  50531 [ACK] Seq=87827 Ack=2511 Win=64128 Len=1440 [TCP PDU reassembled in 171]"
"162","13.236993","2405:200:1630:1200::312c:b3b8","2405:201:5006:95a:3ddc:1390:95b:795e","TCP","1514","443  >  50531 [ACK] Seq=89267 Ack=2511 Win=64128 Len=1440 [TCP PDU reassembled in 171]"
"163","13.236993","2405:200:1630:1200::312c:b3b8","2405:201:5006:95a:3ddc:1390:95b:795e","TCP","1514","443  >  50531 [ACK] Seq=90707 Ack=2511 Win=64128 Len=1440 [TCP PDU reassembled in 171]"
"164","13.236993","2405:200:1630:1200::312c:b3b8","2405:201:5006:95a:3ddc:1390:95b:795e","TCP","1514","443  >  50531 [PSH, ACK] Seq=92147 Ack=2511 Win=64128 Len=1440 [TCP PDU reassembled in 171]"
"165","13.237093","2405:201:5006:95a:3ddc:1390:95b:795e","2405:200:1630:1200::312c:b3b8","TCP","74","50531  >  443 [ACK] Seq=2511 Ack=93587 Win=131584 Len=0"
"166","13.239473","2405:200:1630:1200::312c:b3b8","2405:201:5006:95a:3ddc:1390:95b:795e","TCP","1514","443  >  50531 [ACK] Seq=93587 Ack=2511 Win=64128 Len=1440 [TCP PDU reassembled in 171]"
"167","13.239473","2405:200:1630:1200::312c:b3b8","2405:201:5006:95a:3ddc:1390:95b:795e","TCP","1514","443  >  50531 [ACK] Seq=95027 Ack=2511 Win=64128 Len=1440 [TCP PDU reassembled in 171]"
"168","13.239473","2405:200:1630:1200::312c:b3b8","2405:201:5006:95a:3ddc:1390:95b:795e","TCP","1514","443  >  50531 [ACK] Seq=96467 Ack=2511 Win=64128 Len=1440 [TCP PDU reassembled in 171]"
"169","13.239473","2405:200:1630:1200::312c:b3b8","2405:201:5006:95a:3ddc:1390:95b:795e","TCP","1514","443  >  50531 [ACK] Seq=97907 Ack=2511 Win=64128 Len=1440 [TCP PDU reassembled in 171]"
"170","13.239473","2405:200:1630:1200::312c:b3b8","2405:201:5006:95a:3ddc:1390:95b:795e","TCP","1514","443  >  50531 [ACK] Seq=99347 Ack=2511 Win=64128 Len=1440 [TCP PDU reassembled in 171]"
"171","13.239473","2405:200:1630:1200::312c:b3b8","2405:201:5006:95a:3ddc:1390:95b:795e","TLSv1.3","1514","Application Data, Application Data"
"172","13.239473","2405:200:1630:1200::312c:b3b8","2405:201:5006:95a:3ddc:1390:95b:795e","TCP","1514","443  >  50531 [ACK] Seq=102227 Ack=2511 Win=64128 Len=1440 [TCP PDU reassembled in 183]"
"173","13.239473","2405:200:1630:1200::312c:b3b8","2405:201:5006:95a:3ddc:1390:95b:795e","TCP","1514","443  >  50531 [ACK] Seq=103667 Ack=2511 Win=64128 Len=1440 [TCP PDU reassembled in 183]"
"174","13.239473","2405:200:1630:1200::312c:b3b8","2405:201:5006:95a:3ddc:1390:95b:795e","TCP","1514","443  >  50531 [ACK] Seq=105107 Ack=2511 Win=64128 Len=1440 [TCP PDU reassembled in 183]"
"175","13.239473","2405:200:1630:1200::312c:b3b8","2405:201:5006:95a:3ddc:1390:95b:795e","TCP","1514","443  >  50531 [ACK] Seq=106547 Ack=2511 Win=64128 Len=1440 [TCP PDU reassembled in 183]"
"176","13.239473","2405:200:1630:1200::312c:b3b8","2405:201:5006:95a:3ddc:1390:95b:795e","TCP","1514","443  >  50531 [PSH, ACK] Seq=107987 Ack=2511 Win=64128 Len=1440 [TCP PDU reassembled in 183]"
"177","13.239714","2405:201:5006:95a:3ddc:1390:95b:795e","2405:200:1630:1200::312c:b3b8","TCP","74","50531  >  443 [ACK] Seq=2511 Ack=109427 Win=131584 Len=0"
"178","13.239967","2405:200:1630:1200::312c:b3b8","2405:201:5006:95a:3ddc:1390:95b:795e","TCP","1514","443  >  50531 [ACK] Seq=109427 Ack=2511 Win=64128 Len=1440 [TCP PDU reassembled in 183]"
"179","13.239967","2405:200:1630:1200::312c:b3b8","2405:201:5006:95a:3ddc:1390:95b:795e","TCP","1514","443  >  50531 [ACK] Seq=110867 Ack=2511 Win=64128 Len=1440 [TCP PDU reassembled in 183]"
"180","13.239967","2405:200:1630:1200::312c:b3b8","2405:201:5006:95a:3ddc:1390:95b:795e","TCP","1514","443  >  50531 [ACK] Seq=112307 Ack=2511 Win=64128 Len=1440 [TCP PDU reassembled in 183]"
"181","13.239967","2405:200:1630:1200::312c:b3b8","2405:201:5006:95a:3ddc:1390:95b:795e","TCP","1514","443  >  50531 [ACK] Seq=113747 Ack=2511 Win=64128 Len=1440 [TCP PDU reassembled in 183]"
"182","13.239967","2405:200:1630:1200::312c:b3b8","2405:201:5006:95a:3ddc:1390:95b:795e","TCP","1514","443  >  50531 [ACK] Seq=115187 Ack=2511 Win=64128 Len=1440 [TCP PDU reassembled in 183]"
"183","13.239967","2405:200:1630:1200::312c:b3b8","2405:201:5006:95a:3ddc:1390:95b:795e","TLSv1.3","1514","Application Data, Application Data"
"184","13.240036","2405:201:5006:95a:3ddc:1390:95b:795e","2405:200:1630:1200::312c:b3b8","TCP","74","50531  >  443 [ACK] Seq=2511 Ack=118067 Win=131584 Len=0"
"185","13.240153","2405:200:1630:1200::312c:b3b8","2405:201:5006:95a:3ddc:1390:95b:795e","TCP","1514","443  >  50531 [ACK] Seq=118067 Ack=2511 Win=64128 Len=1440 [TCP PDU reassembled in 196]"
"186","13.240153","2405:200:1630:1200::312c:b3b8","2405:201:5006:95a:3ddc:1390:95b:795e","TCP","1514","443  >  50531 [ACK] Seq=119507 Ack=2511 Win=64128 Len=1440 [TCP PDU reassembled in 196]"
"187","13.240153","2405:200:1630:1200::312c:b3b8","2405:201:5006:95a:3ddc:1390:95b:795e","TCP","1514","443  >  50531 [ACK] Seq=120947 Ack=2511 Win=64128 Len=1440 [TCP PDU reassembled in 196]"
"188","13.240153","2405:200:1630:1200::312c:b3b8","2405:201:5006:95a:3ddc:1390:95b:795e","TCP","1514","443  >  50531 [ACK] Seq=122387 Ack=2511 Win=64128 Len=1440 [TCP PDU reassembled in 196]"
"189","13.240199","2405:201:5006:95a:3ddc:1390:95b:795e","2405:200:1630:1200::312c:b3b8","TCP","74","50531  >  443 [ACK] Seq=2511 Ack=123827 Win=131584 Len=0"
"190","13.241246","2405:200:1630:1200::312c:b3b8","2405:201:5006:95a:3ddc:1390:95b:795e","TCP","1514","443  >  50531 [ACK] Seq=123827 Ack=2511 Win=64128 Len=1440 [TCP PDU reassembled in 196]"
"191","13.241246","2405:200:1630:1200::312c:b3b8","2405:201:5006:95a:3ddc:1390:95b:795e","TCP","1514","443  >  50531 [PSH, ACK] Seq=125267 Ack=2511 Win=64128 Len=1440 [TCP PDU reassembled in 196]"
"192","13.241246","2405:200:1630:1200::312c:b3b8","2405:201:5006:95a:3ddc:1390:95b:795e","TCP","1514","443  >  50531 [ACK] Seq=126707 Ack=2511 Win=64128 Len=1440 [TCP PDU reassembled in 196]"
"193","13.241246","2405:200:1630:1200::312c:b3b8","2405:201:5006:95a:3ddc:1390:95b:795e","TCP","1514","443  >  50531 [ACK] Seq=128147 Ack=2511 Win=64128 Len=1440 [TCP PDU reassembled in 196]"
"194","13.241246","2405:200:1630:1200::312c:b3b8","2405:201:5006:95a:3ddc:1390:95b:795e","TCP","1514","443  >  50531 [ACK] Seq=129587 Ack=2511 Win=64128 Len=1440 [TCP PDU reassembled in 196]"
"195","13.241246","2405:200:1630:1200::312c:b3b8","2405:201:5006:95a:3ddc:1390:95b:795e","TCP","1514","443  >  50531 [ACK] Seq=131027 Ack=2511 Win=64128 Len=1440 [TCP PDU reassembled in 196]"
"196","13.241246","2405:200:1630:1200::312c:b3b8","2405:201:5006:95a:3ddc:1390:95b:795e","TLSv1.3","1514","Application Data, Application Data"
"197","13.241246","2405:200:1630:1200::312c:b3b8","2405:201:5006:95a:3ddc:1390:95b:795e","TCP","1514","443  >  50531 [PSH, ACK] Seq=133907 Ack=2511 Win=64128 Len=1440 [TCP PDU reassembled in 211]"
"198","13.241338","2405:201:5006:95a:3ddc:1390:95b:795e","2405:200:1630:1200::312c:b3b8","TCP","74","50531  >  443 [ACK] Seq=2511 Ack=135347 Win=131584 Len=0"
"199","13.241652","2405:200:1630:1200::312c:b3b8","2405:201:5006:95a:3ddc:1390:95b:795e","TCP","1514","443  >  50531 [ACK] Seq=135347 Ack=2511 Win=64128 Len=1440 [TCP PDU reassembled in 211]"
"200","13.241652","2405:200:1630:1200::312c:b3b8","2405:201:5006:95a:3ddc:1390:95b:795e","TCP","1514","443  >  50531 [ACK] Seq=136787 Ack=2511 Win=64128 Len=1440 [TCP PDU reassembled in 211]"
"201","13.241652","2405:200:1630:1200::312c:b3b8","2405:201:5006:95a:3ddc:1390:95b:795e","TCP","1514","443  >  50531 [ACK] Seq=138227 Ack=2511 Win=64128 Len=1440 [TCP PDU reassembled in 211]"
"202","13.241652","2405:200:1630:1200::312c:b3b8","2405:201:5006:95a:3ddc:1390:95b:795e","TCP","1514","443  >  50531 [ACK] Seq=139667 Ack=2511 Win=64128 Len=1440 [TCP PDU reassembled in 211]"
"203","13.241652","2405:200:1630:1200::312c:b3b8","2405:201:5006:95a:3ddc:1390:95b:795e","TCP","1514","443  >  50531 [ACK] Seq=141107 Ack=2511 Win=64128 Len=1440 [TCP PDU reassembled in 211]"
"204","13.241652","2405:200:1630:1200::312c:b3b8","2405:201:5006:95a:3ddc:1390:95b:795e","TCP","1514","443  >  50531 [PSH, ACK] Seq=142547 Ack=2511 Win=64128 Len=1440 [TCP PDU reassembled in 211]"
"205","13.241730","2405:201:5006:95a:3ddc:1390:95b:795e","2405:200:1630:1200::312c:b3b8","TCP","74","50531  >  443 [ACK] Seq=2511 Ack=143987 Win=131584 Len=0"
"206","13.242534","2405:200:1630:1200::312c:b3b8","2405:201:5006:95a:3ddc:1390:95b:795e","TCP","1514","443  >  50531 [ACK] Seq=143987 Ack=2511 Win=64128 Len=1440 [TCP PDU reassembled in 211]"
"207","13.242534","2405:200:1630:1200::312c:b3b8","2405:201:5006:95a:3ddc:1390:95b:795e","TCP","1514","443  >  50531 [ACK] Seq=145427 Ack=2511 Win=64128 Len=1440 [TCP PDU reassembled in 211]"
"208","13.242534","2405:200:1630:1200::312c:b3b8","2405:201:5006:95a:3ddc:1390:95b:795e","TCP","1514","443  >  50531 [ACK] Seq=146867 Ack=2511 Win=64128 Len=1440 [TCP PDU reassembled in 211]"
"209","13.242534","2405:200:1630:1200::312c:b3b8","2405:201:5006:95a:3ddc:1390:95b:795e","TCP","1514","443  >  50531 [ACK] Seq=148307 Ack=2511 Win=64128 Len=1440 [TCP PDU reassembled in 211]"
"210","13.242594","2405:201:5006:95a:3ddc:1390:95b:795e","2405:200:1630:1200::312c:b3b8","TCP","74","50531  >  443 [ACK] Seq=2511 Ack=149747 Win=131584 Len=0"
"211","13.243771","2405:200:1630:1200::312c:b3b8","2405:201:5006:95a:3ddc:1390:95b:795e","TLSv1.3","1514","Application Data, Application Data"
"212","13.243771","2405:200:1630:1200::312c:b3b8","2405:201:5006:95a:3ddc:1390:95b:795e","TCP","1514","443  >  50531 [PSH, ACK] Seq=151187 Ack=2511 Win=64128 Len=1440 [TCP PDU reassembled in 223]"
"213","13.243771","2405:200:1630:1200::312c:b3b8","2405:201:5006:95a:3ddc:1390:95b:795e","TCP","1514","443  >  50531 [ACK] Seq=152627 Ack=2511 Win=64128 Len=1440 [TCP PDU reassembled in 223]"
"214","13.243771","2405:200:1630:1200::312c:b3b8","2405:201:5006:95a:3ddc:1390:95b:795e","TCP","1514","443  >  50531 [ACK] Seq=154067 Ack=2511 Win=64128 Len=1440 [TCP PDU reassembled in 223]"
"215","13.243771","2405:200:1630:1200::312c:b3b8","2405:201:5006:95a:3ddc:1390:95b:795e","TCP","1514","443  >  50531 [ACK] Seq=155507 Ack=2511 Win=64128 Len=1440 [TCP PDU reassembled in 223]"
"216","13.243771","2405:200:1630:1200::312c:b3b8","2405:201:5006:95a:3ddc:1390:95b:795e","TCP","1514","443  >  50531 [ACK] Seq=156947 Ack=2511 Win=64128 Len=1440 [TCP PDU reassembled in 223]"
"217","13.243771","2405:200:1630:1200::312c:b3b8","2405:201:5006:95a:3ddc:1390:95b:795e","TCP","1514","443  >  50531 [ACK] Seq=158387 Ack=2511 Win=64128 Len=1440 [TCP PDU reassembled in 223]"
"218","13.243771","2405:200:1630:1200::312c:b3b8","2405:201:5006:95a:3ddc:1390:95b:795e","TCP","1514","443  >  50531 [ACK] Seq=159827 Ack=2511 Win=64128 Len=1440 [TCP PDU reassembled in 223]"
"219","13.243885","2405:201:5006:95a:3ddc:1390:95b:795e","2405:200:1630:1200::312c:b3b8","TCP","74","50531  >  443 [ACK] Seq=2511 Ack=161267 Win=131584 Len=0"
"220","13.244247","2405:200:1630:1200::312c:b3b8","2405:201:5006:95a:3ddc:1390:95b:795e","TCP","1514","443  >  50531 [ACK] Seq=161267 Ack=2511 Win=64128 Len=1440 [TCP PDU reassembled in 223]"
"221","13.244247","2405:200:1630:1200::312c:b3b8","2405:201:5006:95a:3ddc:1390:95b:795e","TCP","1514","443  >  50531 [PSH, ACK] Seq=162707 Ack=2511 Win=64128 Len=1440 [TCP PDU reassembled in 223]"
"222","13.244247","2405:200:1630:1200::312c:b3b8","2405:201:5006:95a:3ddc:1390:95b:795e","TCP","1514","443  >  50531 [ACK] Seq=164147 Ack=2511 Win=64128 Len=1440 [TCP PDU reassembled in 223]"
"223","13.244247","2405:200:1630:1200::312c:b3b8","2405:201:5006:95a:3ddc:1390:95b:795e","TLSv1.3","1514","Application Data, Application Data"
"224","13.244247","2405:200:1630:1200::312c:b3b8","2405:201:5006:95a:3ddc:1390:95b:795e","TCP","1514","443  >  50531 [ACK] Seq=167027 Ack=2511 Win=64128 Len=1440 [TCP PDU reassembled in 237]"
"225","13.244247","2405:200:1630:1200::312c:b3b8","2405:201:5006:95a:3ddc:1390:95b:795e","TCP","1514","443  >  50531 [ACK] Seq=168467 Ack=2511 Win=64128 Len=1440 [TCP PDU reassembled in 237]"
"226","13.244350","2405:201:5006:95a:3ddc:1390:95b:795e","2405:200:1630:1200::312c:b3b8","TCP","74","50531  >  443 [ACK] Seq=2511 Ack=169907 Win=131584 Len=0"
"227","13.244608","2405:200:1630:1200::312c:b3b8","2405:201:5006:95a:3ddc:1390:95b:795e","TCP","1514","443  >  50531 [ACK] Seq=169907 Ack=2511 Win=64128 Len=1440 [TCP PDU reassembled in 237]"
"228","13.244608","2405:200:1630:1200::312c:b3b8","2405:201:5006:95a:3ddc:1390:95b:795e","TCP","1514","443  >  50531 [ACK] Seq=171347 Ack=2511 Win=64128 Len=1440 [TCP PDU reassembled in 237]"
"229","13.244608","2405:200:1630:1200::312c:b3b8","2405:201:5006:95a:3ddc:1390:95b:795e","TCP","1514","443  >  50531 [PSH, ACK] Seq=172787 Ack=2511 Win=64128 Len=1440 [TCP PDU reassembled in 237]"
"230","13.244666","2405:201:5006:95a:3ddc:1390:95b:795e","2405:200:1630:1200::312c:b3b8","TCP","74","50531  >  443 [ACK] Seq=2511 Ack=174227 Win=131584 Len=0"
"231","13.245325","2405:200:1630:1200::312c:b3b8","2405:201:5006:95a:3ddc:1390:95b:795e","TCP","1514","443  >  50531 [ACK] Seq=174227 Ack=2511 Win=64128 Len=1440 [TCP PDU reassembled in 237]"
"232","13.245325","2405:200:1630:1200::312c:b3b8","2405:201:5006:95a:3ddc:1390:95b:795e","TCP","1514","443  >  50531 [ACK] Seq=175667 Ack=2511 Win=64128 Len=1440 [TCP PDU reassembled in 237]"
"233","13.245325","2405:200:1630:1200::312c:b3b8","2405:201:5006:95a:3ddc:1390:95b:795e","TCP","1514","443  >  50531 [ACK] Seq=177107 Ack=2511 Win=64128 Len=1440 [TCP PDU reassembled in 237]"
"234","13.245325","2405:200:1630:1200::312c:b3b8","2405:201:5006:95a:3ddc:1390:95b:795e","TCP","1514","443  >  50531 [ACK] Seq=178547 Ack=2511 Win=64128 Len=1440 [TCP PDU reassembled in 237]"
"235","13.245325","2405:200:1630:1200::312c:b3b8","2405:201:5006:95a:3ddc:1390:95b:795e","TCP","1514","443  >  50531 [ACK] Seq=179987 Ack=2511 Win=64128 Len=1440 [TCP PDU reassembled in 237]"
